<?xml version="1.0" encoding="utf-8"?>
<?xml-stylesheet type="text/xsl" href="../../../../../../../../../languagetool-core/src/main/resources/org/languagetool/rules/print.xsl" title="Pretty print" ?>
<?xml-stylesheet type="text/css" href="../../../../../../../../../languagetool-core/src/main/resources/org/languagetool/rules/rules.css" title="Easy editing stylesheet" ?>
<rules lang="ca-ES-valencia" xmlns:xsi="http://www.w3.org/2001/XMLSchema-instance" xsi:noNamespaceSchemaLocation="../../../../../../../../../languagetool-core/src/main/resources/org/languagetool/rules/rules.xsd">
    <category id="VALENCIAN_RULES" name="Regles específiques per al diccionari valencià" type="grammar">
        <rule id="AMANEIXER" name="amanèixer (sinònim d'aparèixer)"> <!--només va amb el dicionari DNV-->
            <pattern>
                <token inflected="yes">amanèixer<exception inflected="yes">amanir</exception></token>
            </pattern>
            <message>Només és correcte en el sentit de 'aparèixer' (DNV). Per a altres sentits useu altres expressions.</message>
            <suggestion>(apuntar el dia)</suggestion>
            <suggestion>(fer-se clar)</suggestion>
            <suggestion>(fer-se de dia)</suggestion>
            <suggestion>(clarejar)</suggestion>
            <suggestion>(despertar-se)</suggestion>
            <suggestion>(a trenc d'alba)</suggestion>
            <example correction="(apuntar el dia)|(fer-se clar)|(fer-se de dia)|(clarejar)|(despertar-se)|(a trenc d'alba)">Aquell dia <marker>amaneixia</marker> amb fred.</example>
            <example>Amaneix bé l'ensalada.</example>
        </rule>
    </category>
</rules>