<?xml version="1.0" encoding="utf-8"?>
<?xml-stylesheet type="text/xsl" href="../print.xsl" title="Pretty print" ?>
<?xml-stylesheet type="text/css" href="../rules.css" title="Easy editing stylesheet" ?>
<!--
A demo rule file for LanguageTool
Copyright (C) 2005 Daniel Naber (http://www.danielnaber.de)

This library is free software; you can redistribute it and/or
modify it under the terms of the GNU Lesser General Public
License as published by the Free Software Foundation; either
version 2.1 of the License, or (at your option) any later version.

This library is distributed in the hope that it will be useful,
but WITHOUT ANY WARRANTY; without even the implied warranty of
MERCHANTABILITY or FITNESS FOR A PARTICULAR PURPOSE. See the GNU
Lesser General Public License for more details.

You should have received a copy of the GNU Lesser General Public
License along with this library; if not, write to the Free Software
Foundation, Inc., 51 Franklin St, Fifth Floor, Boston, MA 02110-1301, USA

$Id$
-->

<rules lang="cs" xmlns:xsi="http://www.w3.org/2001/XMLSchema-instance"
         xsi:noNamespaceSchemaLocation="../rules.xsd">

  <category name="misc">

    <!-- a trivialdemo rule that matches "foo" followed by "bar" -->
    <rule id="DEMO_RULE" name="Find 'foo bar'">
      <pattern case_sensitive="no">
        <token>foo</token>
        <token>bar</token>
      </pattern>
      <message>Did you mean <suggestion>fuu bah</suggestion>?</message>
      <example type="correct">This is <marker>fuu bah</marker>.</example>
      <example type="incorrect">This is <marker>foo bar</marker>.</example>
    </rule>

  </category>

</rules>
