<?xml version="1.0" encoding="UTF-8"?>
<?xml-stylesheet type="text/xsl" href="../../../../../../../../../languagetool-core/src/main/resources/org/languagetool/rules/print.xsl" title="Pretty print" ?>
<?xml-stylesheet type="text/css" href="../../../../../../../../../languagetool-core/src/main/resources/org/languagetool/rules/rules.css" title="Easy editing stylesheet" ?>
<!--
Dutch Style Rules for LanguageTool
See tagset.txt for the meaning of the POS tags
Copyright (C) 2001-2023 Daniel Naber (http://www.danielnaber.de),
  Marcin Miłkowski, and the LanguageTool contributors
This library is free software; you can redistribute it and/or
modify it under the terms of the GNU Lesser General Public
License as published by the Free Software Foundation; either
version 2.1 of the License, or (at your option) any later version.
This library is distributed in the hope that it will be useful,
but WITHOUT ANY WARRANTY; without even the implied warranty of
MERCHANTABILITY or FITNESS FOR A PARTICULAR PURPOSE.  See the GNU
Lesser General Public License for more details.
You should have received a copy of the GNU Lesser General Public
License along with this library; if not, write to the Free Software
Foundation, Inc., 51 Franklin St, Fifth Floor, Boston, MA  02110-1301
USA
-->
<rules lang="nl" xsi:noNamespaceSchemaLocation="https://raw.githubusercontent.com/languagetool-org/languagetool/master/languagetool-core/src/main/resources/org/languagetool/rules/rules.xsd" xmlns:xsi="http://www.w3.org/2001/XMLSchema-instance" xmlns:xs="http://www.w3.org/2001/XMLSchema">
    <category id="STYLE_NLBE" name="style rules" type="style" default="off">
        <rule id="TEMP_RULE_NLBE" name="temp rule">
            <pattern>
                <token>Belgie</token>
            </pattern>
            <message>Test rule.</message>
            <suggestion>België</suggestion>
            <example correction="België"><marker>Belgie</marker></example>
        </rule>
    </category>
</rules>