<?xml version="1.0" encoding="UTF-8"?>
<?xml-stylesheet type="text/xsl" href="../../../../../../../../../languagetool-core/src/main/resources/org/languagetool/rules/print.xsl" title="Pretty print" ?>
<?xml-stylesheet type="text/css" href="../../../../../../../../../languagetool-core/src/main/resources/org/languagetool/rules/rules.css" title="Easy editing stylesheet" ?>
<!--
 LanguageTool Premium Error Detection Rules - Style
 Copyright (C) 2023  LanguageTooler GmbH
 All rights reserved - not part of the Open Source edition
-->
<rules premium="yes" lang="pt" xsi:noNamespaceSchemaLocation="https://raw.githubusercontent.com/languagetool-org/languagetool/master/languagetool-core/src/main/resources/org/languagetool/rules/rules.xsd" xmlns:xsi="http://www.w3.org/2001/XMLSchema-instance" xmlns:xs="http://www.w3.org/2001/XMLSchema">
    <category id="STYLE" name="style rules" type="style">
        <rule id="REMOVEME_RULE3" name="test rule" default="off">
            <pattern>
                <token>realizaaar</token>
            </pattern>
            <message>Test rule.</message>
            <suggestion>realizar</suggestion>
            <example correction="realizar"><marker>realizaaar</marker></example>
        </rule>
    </category>
</rules>
